{
  "record_id": "REL-MODEL-DJI-MAVIC-3-ENTERPRISE-SUPPORTS_SDK-SDK-DJI-MOBILE-SDK-V5-PAYLOAD-SDK-MAVIC-3-ENTERPRISE-SERIES推荐PSDK-3-9-2",
  "record_type": "relation",
  "subject_id": "MODEL-DJI-MAVIC-3-ENTERPRISE",
  "predicate": "supports_sdk",
  "object_id": "SDK-DJI-MOBILE-SDK-V5-PAYLOAD-SDK-MAVIC-3-ENTERPRISE-SERIES推荐PSDK-3-9-2",
  "source_id": "SRC-DJI-87A19CA5EE",
  "evidence_quote": "DJI Mobile SDK V5；Payload SDK（Mavic 3 Enterprise Series推荐PSDK 3.9.2）",
  "evidence_locator": "member-one model table > SDK/开发接口",
  "record_status": "reviewed"
}
