{
  "record_id": "REL-DATASET-MMAUD-CONTAINS_COMPONENT-MODALITY-TRAJECTORY",
  "record_type": "relation",
  "subject_id": "DATASET-MMAUD",
  "predicate": "contains_component",
  "object_id": "MODALITY-TRAJECTORY",
  "source_id": "SRC-MMAUD-83702A3E25",
  "evidence_quote": "trajectory",
  "evidence_locator": "member-two dataset card > modalities",
  "record_status": "reviewed"
}
